{
  "survey_csv": "glint_demo_data.csv",
  "input_format": "wide_items",
  "scale_points": 5,
  "emp_id_col": "user_id",
  "attribute_cols": ["client_uuid", "survey_cycle_title"],
  "min_group_size": 5,
  "analyses": [
    "descriptives",
    "response_distribution",
    "correlations",
    "factor_analysis",
    "by_attribute"
  ]
}
